{
  "schema_version": 1,
  "operation_id": "f82e44a1-1b2c-46cc-8845-c98cb310bbef",
  "operation": "set_work_similarity",
  "target": "primary",
  "left": {
    "id": "intouchables-2011"
  },
  "right": {
    "id": "green-book-2018"
  },
  "terms": [
    "genre.drama",
    "genre.comedy",
    "characters.depth"
  ],
  "note": "Зритель прямо сравнил «1+1» с «Зелёной книгой»: обе истории сочетают драму и юмор, в центре — развитие дружбы богатого человека, переживающего трудности, и его наёмного помощника, несмотря на социальную дистанцию. Фильм «1+1» смотрел давно, несколько раз по телевидению; подробности помнит не очень хорошо."
}
